{
  "schemaVersion": "decision-comparative-replay-gold/v1",
  "comparatorVersion": "policy-replay-reference-v1",
  "generatorDigest": "sha256:70b3747cd8365d00a685a312b85aadb208a8acd450ce530d5696e281b76b6d34",
  "roots": [
    {
      "id": "d23-calibration-priority-loss-001",
      "gold": {
        "status": "completed",
        "outcomeChanged": true,
        "acceptanceChanged": false,
        "ruleChanged": true,
        "unreplayable": false
      }
    },
    {
      "id": "d23-calibration-priority-loss-002",
      "gold": {
        "status": "completed",
        "outcomeChanged": true,
        "acceptanceChanged": false,
        "ruleChanged": false,
        "unreplayable": false
      }
    },
    {
      "id": "d23-calibration-priority-loss-003",
      "gold": {
        "status": "completed",
        "outcomeChanged": true,
        "acceptanceChanged": false,
        "ruleChanged": true,
        "unreplayable": false
      }
    },
    {
      "id": "d23-calibration-priority-loss-004",
      "gold": {
        "status": "completed",
        "outcomeChanged": true,
        "acceptanceChanged": false,
        "ruleChanged": false,
        "unreplayable": false
      }
    },
    {
      "id": "d23-calibration-priority-loss-005",
      "gold": {
        "status": "completed",
        "outcomeChanged": true,
        "acceptanceChanged": false,
        "ruleChanged": true,
        "unreplayable": false
      }
    },
    {
      "id": "d23-calibration-priority-loss-006",
      "gold": {
        "status": "completed",
        "outcomeChanged": true,
        "acceptanceChanged": false,
        "ruleChanged": false,
        "unreplayable": false
      }
    },
    {
      "id": "d23-calibration-priority-loss-007",
      "gold": {
        "status": "completed",
        "outcomeChanged": true,
        "acceptanceChanged": false,
        "ruleChanged": true,
        "unreplayable": false
      }
    },
    {
      "id": "d23-calibration-priority-loss-008",
      "gold": {
        "status": "completed",
        "outcomeChanged": true,
        "acceptanceChanged": false,
        "ruleChanged": false,
        "unreplayable": false
      }
    },
    {
      "id": "d23-calibration-priority-loss-009",
      "gold": {
        "status": "completed",
        "outcomeChanged": true,
        "acceptanceChanged": false,
        "ruleChanged": true,
        "unreplayable": false
      }
    },
    {
      "id": "d23-calibration-priority-loss-010",
      "gold": {
        "status": "completed",
        "outcomeChanged": true,
        "acceptanceChanged": false,
        "ruleChanged": false,
        "unreplayable": false
      }
    },
    {
      "id": "d23-calibration-priority-loss-011",
      "gold": {
        "status": "completed",
        "outcomeChanged": true,
        "acceptanceChanged": false,
        "ruleChanged": true,
        "unreplayable": false
      }
    },
    {
      "id": "d23-calibration-priority-loss-012",
      "gold": {
        "status": "completed",
        "outcomeChanged": true,
        "acceptanceChanged": false,
        "ruleChanged": false,
        "unreplayable": false
      }
    },
    {
      "id": "d23-calibration-priority-loss-013",
      "gold": {
        "status": "completed",
        "outcomeChanged": true,
        "acceptanceChanged": false,
        "ruleChanged": true,
        "unreplayable": false
      }
    },
    {
      "id": "d23-calibration-priority-loss-014",
      "gold": {
        "status": "completed",
        "outcomeChanged": true,
        "acceptanceChanged": false,
        "ruleChanged": false,
        "unreplayable": false
      }
    },
    {
      "id": "d23-calibration-priority-loss-015",
      "gold": {
        "status": "completed",
        "outcomeChanged": true,
        "acceptanceChanged": false,
        "ruleChanged": true,
        "unreplayable": false
      }
    },
    {
      "id": "d23-calibration-priority-loss-016",
      "gold": {
        "status": "completed",
        "outcomeChanged": true,
        "acceptanceChanged": false,
        "ruleChanged": false,
        "unreplayable": false
      }
    },
    {
      "id": "d23-calibration-priority-loss-017",
      "gold": {
        "status": "completed",
        "outcomeChanged": true,
        "acceptanceChanged": false,
        "ruleChanged": true,
        "unreplayable": false
      }
    },
    {
      "id": "d23-calibration-priority-loss-018",
      "gold": {
        "status": "completed",
        "outcomeChanged": true,
        "acceptanceChanged": false,
        "ruleChanged": false,
        "unreplayable": false
      }
    },
    {
      "id": "d23-calibration-priority-loss-019",
      "gold": {
        "status": "completed",
        "outcomeChanged": true,
        "acceptanceChanged": false,
        "ruleChanged": true,
        "unreplayable": false
      }
    },
    {
      "id": "d23-calibration-priority-loss-020",
      "gold": {
        "status": "completed",
        "outcomeChanged": true,
        "acceptanceChanged": false,
        "ruleChanged": false,
        "unreplayable": false
      }
    },
    {
      "id": "d23-calibration-priority-loss-021",
      "gold": {
        "status": "completed",
        "outcomeChanged": true,
        "acceptanceChanged": false,
        "ruleChanged": true,
        "unreplayable": false
      }
    },
    {
      "id": "d23-calibration-priority-loss-022",
      "gold": {
        "status": "completed",
        "outcomeChanged": true,
        "acceptanceChanged": false,
        "ruleChanged": false,
        "unreplayable": false
      }
    },
    {
      "id": "d23-calibration-priority-loss-023",
      "gold": {
        "status": "completed",
        "outcomeChanged": true,
        "acceptanceChanged": false,
        "ruleChanged": true,
        "unreplayable": false
      }
    },
    {
      "id": "d23-calibration-priority-loss-024",
      "gold": {
        "status": "completed",
        "outcomeChanged": true,
        "acceptanceChanged": false,
        "ruleChanged": false,
        "unreplayable": false
      }
    },
    {
      "id": "d23-calibration-priority-loss-025",
      "gold": {
        "status": "completed",
        "outcomeChanged": true,
        "acceptanceChanged": false,
        "ruleChanged": true,
        "unreplayable": false
      }
    },
    {
      "id": "d23-calibration-threshold-boundary-001",
      "gold": {
        "status": "completed",
        "outcomeChanged": false,
        "acceptanceChanged": false,
        "ruleChanged": false,
        "unreplayable": false
      }
    },
    {
      "id": "d23-calibration-threshold-boundary-002",
      "gold": {
        "status": "completed",
        "outcomeChanged": false,
        "acceptanceChanged": false,
        "ruleChanged": false,
        "unreplayable": false
      }
    },
    {
      "id": "d23-calibration-threshold-boundary-003",
      "gold": {
        "status": "review",
        "outcomeChanged": true,
        "acceptanceChanged": true,
        "ruleChanged": true,
        "unreplayable": false
      }
    },
    {
      "id": "d23-calibration-threshold-boundary-004",
      "gold": {
        "status": "completed",
        "outcomeChanged": false,
        "acceptanceChanged": false,
        "ruleChanged": false,
        "unreplayable": false
      }
    },
    {
      "id": "d23-calibration-threshold-boundary-005",
      "gold": {
        "status": "completed",
        "outcomeChanged": false,
        "acceptanceChanged": false,
        "ruleChanged": false,
        "unreplayable": false
      }
    },
    {
      "id": "d23-calibration-threshold-boundary-006",
      "gold": {
        "status": "review",
        "outcomeChanged": true,
        "acceptanceChanged": true,
        "ruleChanged": true,
        "unreplayable": false
      }
    },
    {
      "id": "d23-calibration-threshold-boundary-007",
      "gold": {
        "status": "completed",
        "outcomeChanged": false,
        "acceptanceChanged": false,
        "ruleChanged": false,
        "unreplayable": false
      }
    },
    {
      "id": "d23-calibration-threshold-boundary-008",
      "gold": {
        "status": "completed",
        "outcomeChanged": false,
        "acceptanceChanged": false,
        "ruleChanged": false,
        "unreplayable": false
      }
    },
    {
      "id": "d23-calibration-threshold-boundary-009",
      "gold": {
        "status": "review",
        "outcomeChanged": true,
        "acceptanceChanged": true,
        "ruleChanged": true,
        "unreplayable": false
      }
    },
    {
      "id": "d23-calibration-threshold-boundary-010",
      "gold": {
        "status": "completed",
        "outcomeChanged": false,
        "acceptanceChanged": false,
        "ruleChanged": false,
        "unreplayable": false
      }
    },
    {
      "id": "d23-calibration-threshold-boundary-011",
      "gold": {
        "status": "completed",
        "outcomeChanged": false,
        "acceptanceChanged": false,
        "ruleChanged": false,
        "unreplayable": false
      }
    },
    {
      "id": "d23-calibration-threshold-boundary-012",
      "gold": {
        "status": "review",
        "outcomeChanged": true,
        "acceptanceChanged": true,
        "ruleChanged": true,
        "unreplayable": false
      }
    },
    {
      "id": "d23-calibration-threshold-boundary-013",
      "gold": {
        "status": "completed",
        "outcomeChanged": false,
        "acceptanceChanged": false,
        "ruleChanged": false,
        "unreplayable": false
      }
    },
    {
      "id": "d23-calibration-threshold-boundary-014",
      "gold": {
        "status": "completed",
        "outcomeChanged": false,
        "acceptanceChanged": false,
        "ruleChanged": false,
        "unreplayable": false
      }
    },
    {
      "id": "d23-calibration-threshold-boundary-015",
      "gold": {
        "status": "review",
        "outcomeChanged": true,
        "acceptanceChanged": true,